Old,InVision,twitter.com/InVisionApp,201-500,The Digital Product Design platform powering the world’s best user experiences,invisionapp.com/,"New York, NY",USA,Clark Valberg,clarkvalberg,twitter.com/clarkvalberg,http://www.invisionapp.com/company#jobs,
Old,IOpipe,twitter.com/iopipes,1-10,Serverless tech for building and deploying ap,https://www.iopipe.com/,,,Adam Johnson,,,https://angel.co/iopipe/jobs,
New,Iridium Technology,twitter.com/iridiumtek,51-200,Business intelligence and dashboard solutions to leading law firms,https://www.iridium-technology.com/,"Reno, NV",USA,Tom Jones,,,,
New,IVPN,twitter.com/ivpnnet,1-10,Take control of who has access to your private data,https://www.ivpn.net/,Gibraltar,Gibraltar,,,,,
Old,iwantmyname,twitter.com/iwantmyname,11-50,Pure domain management service offering domain registration and DNS hosting. , https://iwantmyname.com/,Wellington,New Zealand,,,,https://iwantmyname.com/jobs,
Old,Jackson River,twitter.com/jacksonriver,11-50,A Next Generation Digital Engagement Platform -  Springboard - Fundraising. ,jacksonriver.com,,USA,Alice Hendricks,,,https://jacksonriver.com/about/jobs,
,Jatheon,twitter.com/Jatheon,1-10,Communication data archiving and social media monitoring solutions,https://jatheon.com,Toronto,Canada,Marko Dinic,,https://twitter.com/mdinic,,
Old,JBS Customer Software,N/A,1-10,Project-Based Custom Applications and Software Solutions ,https://www.jbssolutions.com/,"Chadds Ford, PA",USA,,,,,
Old,Jim's Mowing,twitter.com/jimsmowing_uk,51-200,We mow the lawns of Australia,http://www.jimsmowing.co.uk/,Melbourne ,Australia,Jim Penman,,,http://www.indeed.com/cmp/Jims-Mowing,
Old,Jitbit,twitter.com/jitbit,1-10,Helpdesk software,https://www.jitbit.com/,Edinburgh,Scotland,Alex Jumašev,jitbit,twitter.com/jitbit,,
Old,Jolly Good Code,twitter.com/jollygoodcode,1-10,Ruby on Rails,http://www.jollygoodcode.com/,Singapore,Singapore,Winston Teo Yong Wei,winstonyw,twitter.com/winstonyw,https://glints.sg/companies/9900,
New,Kadenze,twitter.com/KadenzeOfficial,1-10,Make digital learning better for the whole world.,https://www.kadenze.com/,"Los Angeles, CA",USA,Ajay Kapur ,,https://twitter.com/Ajay__Kapur,,
Old,Kalypso LP,twitter.com/KalypsoLP,201-500,Global innovation consulting firm. ,kalypso.com/,"Beachwood, OH ",USA,Chris Kay,,,http://kalypso.com/careers,
Old,Kanopi Studios,twitter.com/kanopi_studios,11-50,"Open Source Design, Development & Support",https://www.kanopistudios.com,,,Anne Stefanyk,eskimoYogi,twitter.com/eskimoYogi,https://www.kanopistudios.com/careers,
Old,Kantree,twitter.com/kantreeapp,1-10,Visual & flexible project manager,https://kantree.io/,Paris,France,,,,https://remotebase.io/company/kantree,
Old,KBMax,twitter.com/KBMax3DCPQ,11-50,Configure Price Quote & Interactive 3D,kbmax.com,"Austin, TX",USA,Bill Culwell,,,http://www.kbmax.com/careers,
Old,Keen IO,twitter.com/keen_io,11-50,Keen IO is a custom analytics back-end for developers.,https://keen.io/,"San Francisco, CA",USA,Kyle Wild,dorkitude,twitter.com/dorkitude,https://keen.io/careers/,
New,Kehona Health,twitter.com/keonahealth,1-10,Healthcare call center software,http://keonahealth.com/,"Chapel Hill, NC",USA,Oakkar Oakkar,,https://twitter.com/oakkar,,
Old,Kellerkinder,twitter.com/KellerkinderDE,1-10,Specialists for Shopware plugin development,https://www.kellerkinder.de,Hockenheim,Germany,Uwe Kleinmann,,https://twitter.com/iUwe,http://www.kellerkinder.de/jobs.html,
Old,KeyCDN,twitter.com/keycdn,1-10,high-performance content delivery network,https://www.keycdn.com/careers,Winterthur,Switzerland,Jonas Krummenacher,,https://twitter.com/jkrummenacher,https://www.keycdn.com,
Old,Khan Academy,twitter.com/khanacademy,51-200,"Learn for free about math, art, computer programming, economics and more",https://www.khanacademy.org,"Mountain View, CA",USA,Salman Khan,salkhanacademy,twitter.com/salkhanacademy,https://www.khanacademy.org/careers,
New,KickBack Rewards systems,N/A,11-50,Rewards programs and loyalty solutions,https://kickbacksystems.com/,"Twin Falls, ID",USA,Pat Lewis,,,,
Old,Kiprosh,https://twitter.com/KiproshHQ,11-50,Software product development firm building powerful Web & Mobile apps,http://kiprosh.com/,Mumbai,India,Rohan Daxini,,twitter.com/rohan_daxini,http://kiprosh.com/careers,
Old,KissMetrics,twitter.com/Kissmetrics,51-200,Kissmetrics is a revolutionary person-based analytics platform for your whole team.,https://kissmetrics.com/,"San Francisco, CA",USA,Brian Kelly,bkkelly,twitter.com/bkkelly,angel list,
New,Kitsbow,twitter.com/kitsbow?lang=en,1-10,Create unrivaled gear made with the best materials available.,https://www.kitsbow.com/,"Petaluma, CA",USA,David Billstrom,,,,
New,KIZEN,N/A,11-50,"Next-generation technology and AI for marketing, sales, and service teams",https://kizen.com/,"San Francisco, CA",USA,John Winner,,,,
Old,Knack,twitter.com/knackhq,1-10,Knack is the easiest way to build your own app,https://www.knack.com/,"Philadelphia, PA",USA,Brandon Griggs,bigboxofbrandon,twitter.com/bigboxofbrandon,https://www.knack.com/jobs/,
Old,Knock Homes,twitter.com/knockhome,11-50,Trade-In Your House Today,https://www.knock.com/jobs,"Atlanta, GA",USA,Sean Black,,,https://www.knock.com/jobs,
Old,KnownFour,twitter.com/KnownFourLtd,11-50," UK based Specialist Tech, Regulatory, Saas, CleanTech, Finance Recruitment Business",http://www.knownfour.com,London,UK,Annil Chandel,,https://twitter.com/Annilc/,,
Old,Koding,twitter.com/koding,1-10,It's a dev environment automation platform,http://koding.com,"San Francisco, CA",USA,Devrim Yasar,devrimyasar,twitter.com/devrimyasar,https://jobs.lever.co/koding,
New,Komodo Platform,twitter.com/komodoplatform,11-50,Open-Source Infrastructure For An Interoperable Blockchain Ecosystem,https://komodoplatform.com/,,Vietnam,Ben Fairbank,,,,
New,Komoot,twitter.com/komoot,1-10,Better Planning and Navigation for Hikers and Bikers,https://www.komoot.com/,Berlin,Germany,Jonas Spengler,,https://twitter.com/jonaskmt,,
New,Kontist,twitter.com/kontist,1-10,Give freelancers the peace of mind they deserve in the 21st century,https://kontist.com/,Berlin,Germany,Christopher Plantener,,,,
New,Kraken,twitter.com/krakenfx,501-1000,Kraken Digital Asset Exchange,https://www.kraken.com/,"San Francisco, CA",USA,Jesse Powell,,https://twitter.com/jespow,,
Old,Kuali,twitter.com/KualiCo,51-200,Simplify Higher Ed Administration,https://www.kuali.co/about/#careers,"Lehi, UT",USA,Joel Dehlin,,,https://www.kuali.co/,
Old,Kyero,twitter.com/kyero,11-50,Real estate portal for international buyers,kyero.com,"Bath, Somerset",UK,Martin Dell,,,,
New,Language Drops,twitter.com/language_drops,11-50,Language learning made easy.,https://languagedrops.com/,Tallinn,Estonia,Daniel Farkas,,,,
Old,Later,twitter.com/latermedia,11-50,#1 Instagram Marketing Platform for Visual Marketers,later.com,"Vancouver, BC",Canada,Roger Patterson,,https://twitter.com/roger_patterson,https://angel.co/latergramme/jobs,
Old,LaterPay,twitter.com/LaterPay,11-50,Letting merchants sell digital content for micropayments,www.laterpay.net/,"München, Bavaria",Germany,Cosmin Ene,cosmoene,twitter.com/cosmoene,https://www.laterpay.net/careers/,
Old,Launch Potato,twitter.com/launchpotato,11-50,"Startup studio leveraging data, science and fund to build awesome, profitable digital companies.",launchpotato.com,"Delray Beach, FL",USA,Greg Van Horn,,twitter.com/domydeal,http//launchpotato.com/careers,
Old,layer,twitter.com/Layer,11-50,"Imagine, Design, and Engage in the Perfect Customer Conversation",layer.com,"San Francisco, CA",USA,Ron Palmeri,,https://twitter.com/RonP,https://layer.com/company/careers/#job-feed,
Old,Lazy Eight,twitter.com/lazyeightdesign,11-50,A creative agency on the cloud.,http://www.lazyeight.design/,New Delhi,India,Nav Chatterji,navchatterji,twitter.com/navchatterji,http://www.lazyeight.in/clients/lazyeight/careers,
Old,Leadfeeder,twitter.com/leadfeederapp,1-10,Sales leads from Google Analytics,https://www.leadfeeder.com/,Helsinki,Finland,Pekka Koskinen,,https://twitter.com/pekkakoskinen,,
Old,LearnZillion,twitter.com/learnzillion,11-50,EdTech, curriculum and prof. dev for K12,https://learnzillion.com,"Washington, DC",USA,Eric Westendorf,twitter.com/,twitter.com/ericwestendorf,https://learnzillion.com/p/company/
Old,Let's Encrypt,twitter.com/letsencrypt,1-10,"Free, automated and open certificate authority for the public’s benefit.",https://letsencrypt.org/,"San Francisco, CA ",USA,Alex Polvi,polvi,twitter.com/polvi,https://letsencrypt.org/jobs/,
Old,Librato,twitter.com/librato,11-50,"Collect, store, and visualize any metrics in minutes.",https://librato.com/,"San Francisco, CA",USA,Fred van den Bosch,fredvdbosch,twitter.com/fredvdbosch,http://solarwinds.jobs/solarwinds-cloud/ ,
Old,Lightbend,twitter.com/lightbend,51-200,Dedicated to helping developers build Reactive applications on the JVM.,http://www.lightbend.com/,"San Francisco, CA ",USA,Mark Brewer,mabrewer7,twitter.com/mabrewer7,http://www.lightbend.com/company/careers,
Old,Linaro,twitter.com/LinaroOrg,201-500,Not-for-profit engineering organization,www.linaro.org/,"Cambridge, MA",USA,George Grey,gcgrey,twitter.com/gcgrey,http://www.linaro.org/careers/,
Old,Lincoln Loop,twitter.com/lincolnloop,1-10,Full service web studio offering user experience & development ,https://lincolnloop.com/,"Chicago, IL ",USA,PETER BAUMGARTNER,ipmb,twitter.com/ipmb,,
Old,LitCharts,twitter.com/litcharts,1-10,Browse 527 LitCharts Literature Guides,https://www.litcharts.com/,"New York, NY",USA,Ben and Justin,,,https://www.litcharts.com/,
Old,Litmus,twitter.com/litmusapp,11-50,Litmus tests and tracks your email campaigns so you can always put your best design forward.,https://litmus.com/,"Cambridge, MA",USA,Paul Farnell,unsalted,twitter.com/unsalted,https://litmus.com/jobs/,
New,Littlelines,twitter.com/littlelines,1-10,Connecting the dots since 2007 - Ruby on Rails & Elixir,https://littlelines.com/,"Dayton, OH",USA,Matt Sears ,,,,
Old,LiveMentor,twitter.com/_livementor,11-50,Online education website,https://www.livementor.com/,Paris,France,Alexandre Dana,alexandredana,twitter.com/alexandredana,https://livementor.workable.com/,
Old,Living Social,twitter.com/LivingSocial,501-1000,Online marketplace that allows clients to buy and share things to do in their city,https://www.livingsocial.com,"Washington, DC",USA,Gautam Thakar,,,jobs.livingsocial.com,
Old,Localistico,twitter.com/localistico,1-10,Localistico make local businesses easier to find online.,http://localistico.com/,London,UK,Ricardo Varela,phobeo,twitter.com/phobeo,https://angel.co/localistico/jobs,
Old,loco2,twitter.com/loco2,11-50,Make booking trains anywhere in Europe as easy and affordable as possible,https://loco2.com/,London,UK,Jamie Andrews,,https://twitter.com/jamieandrews,https://loco2.com/en/careers/,
New,Locus Health,twitter.com/locus_health,11-50,Remote care solutions for population health,https://www.locushealth.com/,"Charlottesville, VA",USA,Kirby Farrell,,,,
Old,log,twitter.com/log_oscon,1-10,WordPress and User Experience,https://log.pt/,Lisbon,Portugal,João Gomes,,,,
New,Logical Engine,twitter.com/logicalengine1,11-50,Solve problems with innovative solutions that build better businesses. ,https://www.logicalengine.com/,"Newburyport, MA",USA,Tom Droste,,,,
Old,Logikcull ,twitter.com/logikcull,51-200,We're putting an end to eDiscovery with Discovery Automation,https://logikcull.com/jobs/,"San Francisco, CA",USA,Andy Wilson,,https://twitter.com/iDedupe,logikcull.com/jobs,
Old,Logmein,twitter.com/LogMeIn,501-1000,Get In and go with remote access from LogMeIn,https://secure.logmein.com/,"Boston, MA",USA,Michael K. Simon,,,https://www.logmeininc.com/careers,
Old,Loom,twitter.com/@useloom,11-50,Faster than typing. We create simple software for you to be your most authentic self ,https://www.useloom.com/,"San Francisco, CA",USA,Joe Thomas,,https://twitter.com/yoyo_thomas,,
New,Loot Crate,twitter.com/lootcrate,1-10,Loot Crate is the worldwide leader in fan subscription boxes.,https://www.lootcrate.com,"Los Angeles, CA",USA,Chris Davis,,,,
New,Lorem,twitter.com/asklorem,51-200,Don’t waste another second searching for freelance work online.,https://www.asklorem.com/,"New York, NY",USA,Sam Wilcoxon,,https://twitter.com/samwilcoxon,,
Old,LoveToKnow,twitter.com/lovetoknow,51-200,Provides expert advice on the topics you need.,http://www.lovetoknow.com/,"Burlingame, CA",USA,Howard Love,howardlove,twitter.com/howardlove,http://www.lovetoknow.com/Careers/careers.html,
Old,Loyal,twitter.com/loyalhealth,1-10,Transparency tools for health systems,https://www.loyalhealth.com,"Atlanta, GA",USA,Chad mallory,,https://twitter.com/chadmallory,https://www.loyalhealth.com/careers,
Old,Lullabot,twitter.com/lullabot,51-200,"Top strategy, design, and development agency specializing in high-performance projects",https://www.lullabot.com/,"Providence, RI",USA,Jeff Robbins,jjeff,twitter.com/jjeff,https://www.lullabot.com/jobs,
Old,Lumiserv,twitter.com/lumiserv,1-10,Mission critical DevOps & cloud management,https://lumiserv.com,Bournemouth,UK,Rad Dougall,raddougall,twitter.com/raddougall,https://lumiserv.com/careers-jobs/,
Old,Lynx Technology Partners,twitter.com/lynxpartners,11-50,Regulatory compliance tools,https://lynxgrc.com/,"New York, NY",USA,Rich Hlavka,richhlavka,twitter.com/richhlavka,https://lynxgrc.com/careers/,
Old,Machinio,twitter.com/machinio,11-50,used machinery marketplace,https://www.machinio.com/careers/,"Chicago, IL",USA,Dmitriy Rokhfeld,,,www.machinio.com,
Old,mailparser.io,twitter.com/mailparser,1-10,Liberate Data Trapped Inside E-mails,https://mailparser.io/,Paris,France,Moritz Dausinger,mdausinger,twitter.com/mdausinger,,
New,Mailprotector,twitter.com/mailprotector,11-50,Providing vital email services,https://www.mailprotector.com/,"Greenville, SC",USA,David Setzer,,,,
New,MailTag.io,twitter.com/MailTagio,1-10,"Helping sales professionals make more sales, in less time.",https://www.mailtag.io/,"Phoenix, AZ",USA,Alex Edson,,,,
New,Maître,N/A,1-10,Word of mouth that drive sales.,https://maitreapp.co/,London,UK,,,,,
Old,Make Works,twitter.com/MakeWorksTO,11-50,Canada’s leading shared R&D lab and co-working space,http://www.makeworks.com/,Toronto,Canada,Mike Stern,,,,
Old,Manage Social,twitter.com/ManageFlitter,1-10, easy to use tools to empower you to work smarter and faster with Twitter,https://manageflitter.com/careers,Sydney,Australia,Kevin Garber,,https://twitter.com/ke_ga,https://manageflitter.com/careers,
Old,Mapbox ,twitter.com/mapbox,51-200,Map integration tools for various platforms.,https://www.mapbox.com/,Washington,USA,Eric Gundersen,ericg,twitter.com/ericg,https://www.mapbox.com/jobs/,
New,Mapillary,twitter.com/mapillary,11-50,Street-level imagery platform that uses computer vision to fix the world’s maps,https://www.mapillary.com/,Malmo,Sweden,Johan Gyllenspetz,,https://twitter.com/gyllen,,
Old,MariaDB,twitter.com/mariadb,1-10,MariaDB and MySQL development and support,https://mariadb.com,"Menlo Park, CA ",USA,Michael Howard,,,https://mariadb.com/,
New,Marketade,twitter.com/marketade,1-10,Lean UX consulting,https://www.marketade.com/,"Washington, DC",USA,John Nicholson,,,,
New,MarketGoo,twitter.com/mktgoo,11-50,Easy SEO Tools for SMBs,www.marketgoo.com ,Madrid,Spain,Wences Garcia,,twitter.com/wencesg,,
Old,MarkIT.eu,twitter.com/markit_eu,51-200,MarkIT is an online IT purchasing system for companies. ,http://markit.eu/,Tallinn,Estonia,Andres Agasild,,,Linkedin,
Old,MarsBased,twitter.com/MarsBased,11-50,Design & development consultancy,https://marsbased.com/jobs/,Barcelona,Spain,Àlex Rodríguez Bacardit,,http://www.twitter.com/lexrodba,https://marsbased.com/jobs/,
New,Marvel Prototyping,twitter.com/marvelapp,1-10,Enable everyone to bring their ideas to life with Marvel,https://marvelapp.com/,London,UK,,,,,
Old,Mattermost,twitter.com/mattermosthq,11-50,"Open source, private cloud Slack-alternative",https://jobs.lever.co/mattermost/,"Palo Alto, CA",USA,Ian Tien,,https://twitter.com/iantien,https://jobs.lever.co/mattermost/,
Old,Mavens,twitter.com/mavens,51-200,Cloud software solutions that are connecting,https://mavens.com/,"Chicago, IL",USA,Prasad Kanumury,pkanumury,twitter.com/pkanumury,https://mavens.com/careers/,
Old,Mcbeard Media,twitter.com/mcbeard,51-200, team of copywriters and designers creating the social media content that great brands share,http://mcbeard.tumblr.com/,"Los Angeles, CA",USA,Alan Beard,,,Linkedin,
Old,MCF Technology Solutions,twitter.com/MCFTechnology,51-200,"MCF Technology Solutions (MCFTech) delivers Services, Strategy..",https://www.mcftech.com/,"Lorain, OH",USA,Govind Davis,,,https://www.mcftech.com/careers/,
New,Mealthy,twitter.com/MealthyRecipes,11-50,Healthy Cooking Made Easy,https://mealthy.com/,"Austin, TX",USA,,,,,
Old,Mediacurrent,twitter.com/mediacurrent,11-50,Full service Drupal agency,http://www.mediacurrent.com/,"Atlanta, GA",USA,Jeff Diecks,jeffdiecks,twitter.com/jeffdiecks,http://www.mediacurrent.com/about/careers,
Old,Meet Edgar,twitter.com/meetedgar,1-10,Automates social media marketing by building a library of your best content,https://meetedgar.com/,,USA,Laura Roeder,,twitter.com/lkr,https://meetedgar.com/careers/,
New,Mega,twitter.com/mega_int,51-200,Help clients engage customers & ultimately grow revenue.,https://www.mega.com,Paris,France,Lucio de Risi,,,,
Old,Member Up,twitter.com/member_up,1-10,Services and products for membership sites,https://memberup.co/,,USA,Michael Steele,el_steele,twitter.com/el_steele,,
New,MercuryWorksCraft ,twitter.com/Mercury_Works,1-10,"create apps, solve wicked problems and forge passionate client relationships",mercuryworks.com,"Tampa, FL",USA,,,,,
New,Mesosphere,twitter.com/mesosphere,201-500,Mesosphere is democratizing the modern infrastructure.,https://mesosphere.com/,"San Francisco, CA",USA,Florian Leibert,,twitter.com/flo,,
New,MetaCommunications,twitter.com/metacomm,501-1000,Project management software for the world’s best creative teams.,https://www.workgroups.com/,"Iowa City, IA",USA,Gregg Hammann,,,,
Old,MetaLab,twitter.com/metalab,11-50,We make interfaces.,http://metalab.co/,?,USA,Andrew Wilkinson,awilkinson,twitter.com/awilkinson,http://metalab.co/careers/,
Old,Metaluxo IT Security,twitter.com/metaluxo,1-10,IT Security services,https://en.metaluxo.com/,London,UK,,,,https://angel.co/metaluxo-it-security/jobs,
Old,Metamaterial Technologies,twitter.com/metamaterialtec,11-50,MTI's technology solves the world's most challenging problems in optics,www.metamaterial.com/,"Halifax, Nova Scotia",Canada,George Palikaras,palikaras,twitter.com/palikaras,http://www.metamaterial.com/join-our-team,
Old,Meteor,twitter.com/meteorjs,501-1000,Meteor is a complete platform for building web and mobile apps in pure JavaScript.,https://www.meteor.com,"San Francisco, CA",USA,Geoff Schmidt,immir,twitter.com/immir,https://www.meteor.com/jobs,
Old,Midokura,twitter.com/midokura,51-200,Enterprise Network Virtualization that works,http://www.midokura.com/,Tokyo,Japan,Dan Mihai Dumitriu,dumitriu,twitter.com/dumitriu,http://www.midokura.com/about-midokura/careers/,
Old,Mightycast,twitter.com/mightycast,11-50,Creative minds from doodlers to tinkerers focused on the future of wearable devices,http://www.thenexband.com/,"Montreal, QC",Canada,Adam Adelman,,,,
New,MiMedx,twitter.com/MiMedx,51-200,Regenerative biologics utilizing human placental tissue allografts,https://mimedx.com/,"Marietta, GA",USA,David Coles,,,,
New,MindSciences,N/A,1-10,Addressing unwanted behaviors and bad habits through evidence-based mindfulness.,claritasmind.com,"Boston, MA",USA,Judson Brewer,,,,
Old,Minter.io,twitter.com/minter_io,1-10,Instagram Analytics,https://minter.io/,London,UK,Mike Minter,,https://twitter.com/mike_mntr,,
Old,Mixcloud,twitter.com/mixcloud,11-50,Mixcloud is an online radio channel providing radio content and DJ music.,https://www.mixcloud.com/,London,UK,Mat Clayton,matclayton,twitter.com/matclayton,https://www.mixcloud.com/jobs/,
Old,Mixmax,twitter.com/mixmaxhq,11-50,Upgrading email to the 21st century,https://mixmax.com/,"San Francisco, CA",USA,Olof Mathé,olofster,twitter.com/olofster,https://mixmax.com/careers/,
Old,Mobile Jazz,twitter.com/mobilejazzcom,11-50,The #1 Boutique App & Web Development Company,https://mobilejazz.com/jobs,Barcelona,Spain,Stefan Klumpp,,https://twitter.com/stefanklumpp,https://mobilejazz.com/,
Old,"Mobility Labs, Inc.",twitter.com/MobilityLabs,11-50,We build digital tools for social good.,http://www.mobility-labs.com/,"Washington, DC",USA,Sean Perkins,seanperkins1,twitter.com/seanperkins1,http://www.mobility-labs.com/careers#available-positions,
New,Mobiquity,twitter.com/mobiquityinc,201-500,Customized mobile solutions at the enterprise level,www.mobiquityinc.com,Amsterdam,The Netherlands,,,,,
Old,Mobomo,twitter.com/MobomoApps,11-50,Software product development,https://www.mobomo.com/,"Washington, DC",USA,Barg Upender,bargupender,twitter.com/bargupender,https://www.mobomo.com/careers/,
New,Modern Tribe,twitter.com/ModernTribeInc,51-200,To give consumers the power to make informed purchasing decisions.,https://tri.be,"San Francisco, CA",USA,,,,,
Old,Modus-create,twitter.com/ModusCreate,11-50,digital design-build agency driven by world-class talent.,https://moduscreate.com/who-we-are/,"Reston, VA",USA,Patrick Sheridan,,https://twitter.com/sheridap,https://moduscreate.com/who-we-are/,
Old,Mokriya,twitter.com/mokriya,11-50,"Crafting Smart, beautiful software for mobile, IoT, and beyond.",mokriya.com,"Cupertino, CA",USA,Sunil Kanderi,Sunil01,twitter.com/Sunil01,indeed / angel list,
Old,Moltin,twitter.com/moltin,11-50,commerce brought to life,https://moltin.recruiterbox.com/,"Boston, MA",USA,Jamie Holdroyd,,https://twitter.com/jHoldroyd,https://moltin.recruiterbox.com/,
Old,Moment,twitter.com/moment,11-50,Maker of the world's best products for mobile photography.,https://www.shopmoment.com/careers,"Seattle, WA",USA,Marc Barros,,https://twitter.com/marcbarros,https://www.shopmoment.com/careers,
Old,Moo.do,twitter.com/moodoapp,1-10,"Organize everything in your life: projects, to-do lists, appointments..",https://www.moo.do/,"Seattle, WA",USA,Jay Meistrich,jmeistrich,twitter.com/jmeistrich,,
New,Moodle,twitter.com/moodle,11-50,Open source Learning Platform,https://moodle.com/,"Perth, WA",Australia,Martin Dougiamas,,https://twitter.com/moodler,,
Old,Moondo,twitter.com/Moondo_CL,1-10,online shopping from spain,http://moondo.cl/,Santiago/London,UK,Andres Tocornal,,,,
Old,Moraware,twitter.com/moraware,1-10,Software for countertop fabricators,http://www.moraware.com/,"Reno, NV",USA,Ted Pitts,ted_pitts,twitter.com/ted_pitts,http://www.moraware.com/company/careers/,
New,Mosalingua,twitter.com/mosalingua,11-50,Method for learning languages on a smartphone,https://www.mosalingua.com/en/,Lyon,France,Luca Sadurny,,twitter.com/lucasadurny,,
Old,MotorLot,twitter.com/motorlot,1-10,Get your auto dealer management software guaranteed to drive sales,motorlot.com/,"Scottsdale, AZ",USA,Korey Bachelder,koreyb,twitter.com/koreyb,angel list linkedin,
New,Moveon.org,twitter.com/moveon,11-50,Nonpartisan education and advocacy on important national issues.,https://front.moveon.org/,"Washington, DC",USA,Anna Galland,,,,
Old,Moz,twitter.com/Moz,51-200,SEO Tools,https://moz.com/,"Seattle, WA",USA,Sarah Bird,sarahbird,twitter.com/sarahbird,https://moz.com/about/jobs,
Old,Mozilla,twitter.com/mozilla,501-1000,Fights to keep the Internet a global public resource open and accessible to all.,https://www.mozilla.org,"Mountain View, CA",USA,Chris Beard,cbeard,twitter.com/cbeard,https://careers.mozilla.org/en-US/,
Old,Much Better Adventures,twitter.com/muchbetteradven,1-10,Award-winning adventures with the best local guides and hosts around the world.,https://muchbetteradventures.workable.com/,London,UK,,,https://twitter.com/alexnarra,https://www.muchbetteradventures.com,
New,Myagi,twitter.com/Myagiapp,11-50,The choo-choo train for retail's Knowledge Supply Chain,https://myagi.com/,"San Francisco, CA",USA,Alex McLeod,,,,
Old,MyOnlineSchool,twitter.com/MyOnlineSchool,1-10," Learning with the experts. Providing certified online courses, taught by bestselling authors.",http://www.my-online-school.co.uk/,,USA,Elspeth Briscoe,Elspeth,twitter.com/Elspeth,,
Old,mySociety,twitter.com/mysociety,11-50,Websites that help citizens demand better,https://www.mysociety.org/,,England,Mark Cridge,markcridge,twitter.com/markcridge,https://www.mysociety.org/about/careers/,
Old,MySQL,twitter.com/MySQL,201-500,"The software's official homepage with news, downloads and documentation.",https://www.mysql.com/,"Cupertino, CA",USA,Marten Mickos,martenmickos,twitter.com/martenmickos,https://www.mysql.fr/about/jobs/,
Old,NationBuilder,twitter.com/NationBuilder,11-50,Software for leaders,http://nationbuilder.com/job_list,"Los Angeles, CA",USA,Lea Endres,,,http://nationbuilder.com,
Old,nClouds,twitter.com/n_Clouds,11-50,nClouds is a leading service provider for dev ops,https://www.nclouds.com/,"San Jose, CA",USA,JT Giri,,,https://www.nclouds.com/careers,
Old,Nearform,twitter.com/nearForm,51-200,Node.js software consulting,http://www.nearform.com/,,Ireland,Cian Ó Maidín,cianomaidin,twitter.com/cianomaidin,http://www.nearform.com/careers/,
New,Nebulab,twitter.com/nebulab_it,1-10,Nebulab is a digital consulting company. ,https://nebulab.it/,,Italy, Guillermo Vela,,,,
Old,Netguru,twitter.com/netguru,51-200,Web and mobile development shop,https://www.netguru.co/,Poznan,Poland,Wiktor Schmidt,wiktorschmidt,twitter.com/wiktorschmidt,https://www.netguru.co/career/meet-us,
New,Netlify,twitter.com/netlify,11-50,Automates code, creating highly-performant sites and web-apps.,https://www.netlify.com/,"San Francisco, CA",USA,Matt Biilmann,,,
Old,Netsparker,twitter.com/netsparker,11-50,Web Application Security Scanner.,https://www.netsparker.com/jobs/,London,UK,Ferruh Mavituna,,https://twitter.com/fmavituna,https://www.netsparker.com/,
