Old,Focus Asia,twitter.com/focusasiatravel,1-10,Focus Asia,http://focus.asia/,Singapore,Singapore,,,,http://focus.asia/careers/,
Old,Fog Creek Software,twitter.com/fogcreek,11-50,Tools for Software Teams,http://www.fogcreek.com/,"New York, NY",USA,Joel Spolsky,spolsky,twitter.com/spolsky,http://www.fogcreek.com/careers,
Old,Folarium Technomedia,twitter.com/folariumtech,1-10,Software Integrated Development,http://www.folarium.co.id/,Yogyakarta,Indonesia,,,,http://www.folarium.co.id/career,
Old,Follow Up Boss,twitter.com/followupboss,11-50,Real Estate Sales CRM,http://www.followupboss.com,"San Francisco, CA",USA,Dan Corkill,buzzdan,twitter.com/buzzdan,https://boards.greenhouse.io/followupboss#.WAZIKxB96b_,
Old,Fonoma,twitter.com/FonomaCuba,11-50,Internationa Bill Payments platform,https://www.fonoma.com/,La Havana,Cuba,Hiram Centelles,hcentelles,twitter.com/hcentelles,,
Old,Forest Admin,twitter.com/forestsaas,1-10,The Admin Interface your application deserves,http://www.forestadmin.com,"San Francisco, CA",USA,Sandro Munda,seyz_,twitter.com/seyz_,https://forestadmin.workable.com/,
New,Forget The Funnel,twitter.com/forgetthefunnel,1-10,Elevate those who are underestimated at tech companies.,https://forgetthefunnel.com/,Montreal,Canada,Georgiana Laudi,,https://twitter.com/ggiiaa,,
Old,FormAssembly,twitter.com/formassembly,11-50,We specialize in web forms and data collection,https://www.formassembly.com/,"Bloomington, IN",USA,Cedric Savarese,,https://twitter.com/cedsav,https://formassembly.workable.com/,
Old,Formstack,twitter.com/Formstack,51-200,An online form building application to create & design any type of HTML web form.,https://www.formstack.com/,"Indianapolis, IN",USA,Chris Byers,rchrisbyers,twitter.com/rchrisbyers,https://www.formstack.com/careers,
Old,Fortumo,twitter.com/fortumo,51-200,"Direct carrier billing in 92 countries for apps, games, digital media companies...",https://fortumo.com/,Tartu,Estonia,Martin Koppel,martinkoppel,twitter.com/martinkoppel,https://careers.fortumo.com/,
Old,Forward Financing,twitter.com/fwd_financing,51-200,Finance + Technology for SMB,https://www.forwardfinancing.com/about/,"Boston, MA",USA,Justin Bakes,,,www.forwardfinancing.com,
Old,Founder Centric,twitter.com/foundercentric,1-10,We design and teach top tier startup education. ,www.foundercentric.com,London,UK,Rob Fitzpatrick,robfitz,twitter.com/robfitz,,
Old,Foundersuite.com,twitter.com/Foundersuite,11-50,CRM for startups raising capital,https://foundersuite.com/,"San Francisco, CA",USA,Nathan Beckord,sailornathan,twitter.com/sailornathan,https://foundersuite.com/jobs,
Old,Foundr Magazine,twitter.com/foundr,1-10,"digital resource for the growing ranks of craft, self-made entrepreneurs",https://foundr.com/about-us/,Melbourne,Australia,Nathan Chan ,,https://twitter.com/NathanHChan,https://foundr.com/careers/content-marketer/,
Old,Four Kitchens,twitter.com/fourkitchens,11-50,We make BIG websites using open-source technology and user-centered design.,https://www.fourkitchens.com,"Austin, TX",USA,Todd Ross Nienkerk,toddross,twitter.com/toddross,https://www.fourkitchens.com/careers/,
Old,fournova,twitter.com/fournova,1-10,Developing apps and tools for developers,https://www.fournova.com/,,,Tobias Günther,gntr,twitter.com/gntr,https://www.fournova.com/jobs,
Old,FoxAndSheep,twitter.com/_foxandsheep,1-10,Developing an exciting new camera app called Chomp,http://www.foxandsheep.com/team/,Berlin,Germany,Verena Pausder,,https://twitter.com/VerenaDE,https://chomp.workable.com/,
Old,Foxio,twitter.com/foxiosays,1-10,We partner with entrepreneurs to craft experience-focused web products that are a joy to use.,http://fox.io/,"Indianapolis, IN",USA,Peter Lockhart,thisispeter,twitter.com/thisispeter,http://fox.io/jobs/,
Old,Frontastic GmbH,twitter.com/frontasticGmbH,1-10,Frontend as a Service – for API Economy,https://www.frontastic.cloud/,Münster,Germany,Thomas Gottheil,,twitter.com/GottheilThomas,,
Old,FRSH,twitter.com/frshonline,1-10,Subscription based healthy meal plan delivery,http://www.frsh.com/#/,"Montreal, QC",Canada,Badal Goel,badalgoel2,twitter.com/badalgoel2,,
Old,Fuel Made,twitter.com/fuelmade,1-10,"We build solid solutions that work across platforms, screen sizes, and browsers, and that age well. ",http://fuelmade.com/,"Spokane, WA",USA,CARSON MCCOMAS,carson,twitter.com/carson,http://fuelmade.com/pages/jobs,
Old,FullStack,twitter.com/gofullstack,1-10,"modern web and mobile technologies to build software products,",http://gofullstack.com/about/,"Iowa City, IA",USA,Josh Cramer,,https://twitter.com/joshcramer,http://gofullstack.com/,
Old,Funding Gates,twitter.com/fundinggates,11-50,"Funding Gates provides credit screening, monitoring and collection tools for SMBs",https://www.fundinggates.com,"New York, NY ",USA,Ismail Colak,ismail_colak,twitter.com/ismail_colak,https://www.fundinggates.com/jobs/,
Old,Funnely,twitter.com/Funne_ly,1-10,Drive qualified leads at a lower cost and transform interested shoppers into buyers.,funne.ly/,"Mountain View, CA",USA,Lucila Campos,lupincampos,twitter.com/lupincampos,angel list,
Old,Futurelytics,twitter.com/futurelytics,1-10,Maximize customer loyalty and revenue. automation platform for e-commerce. ,www.futurelytics.com/,Ostrava,Czech Rep,Daniel Hastik,danhastik,twitter.com/danhastik,angel list,
Old,G2i,twitter.com/g2i_co,1-10,React.js & React Native Development You Can Trust,https://jobs.lever.co/g2i," Delray Beach, FL",USA,Gabe Greenberg,,https://twitter.com/gabe_g2i,https://g2i.co,
New,Gatekeeper,twitter.com/gatekeeperhq,1-10,Bringing clarity to supplier and contract data,https://www.gatekeeperhq.com/,"Vancouver, BC",Canada,Patrick O'Connor,,,,
Old,GatherContent,twitter.com/GatherContent,11-50,"Painlessly plan, organise and produce web con",https://gathercontent.com,London,UK,James Deer,,https://twitter.com/jamesdeer,https://gathercontent.com/careers,
Old,Gear Stream,twitter.com/gearstream,,"Product Innovation, Delivery Speed, & Organizational Agility",https://www.gearstream.com/,"Raleigh, NC",USA,Brad Murphy,,,,
Old,General Assembly,twitter.com/GA,11-50,Online and Campus education,https://generalassemb.ly,"New York, NY",USA,Jake Schwartz,jakeschwartz,twitter.com/jakeschwartz,https://generalassemb.ly/careers,
Old,Genuitec,twitter.com/Genuitec,51-200,Makers of the award winning MyEclipse technology suite for Java EE application development ,https://www.genuitec.com,"Flower Mound, TX",USA,Maher Masri,maherhmasri,twitter.com/maherhmasri,https://www.genuitec.com/company/careers/,
Old,GetFileCloud,twitter.com/tonido,1-10,Organize enterprise information and make it universally accessible,https://www.getfilecloud.com/about-filecloud-team/,"Austin, TX",USA,Madhan Kanagavel,,https://twitter.com/madhankk,https://www.getfilecloud.com/jobs/,
Old,GetIncredibles,twitter.com/getincredibles,1-10,Premium domains based marketplace for remote work.,https://angel.co/get-incredibles,"San Jose, CA",USA,Mannan Amin,,,https://getincredibles.com,
Old,Ghost,twitter.com/tryghost,1-10,Publishing platform.,https://ghost.org/,Singapore,Singapore,John O'Nolan,JohnONolan,twitter.com/JohnONolan,https://ghost.org/about/,
Old,Giant Swarm,twitter.com/giantswarm,11-50,Managed Kubernetes Anywhere.,https://giantswarm.io/,"Köln, Germany",Germany,Henning Lange,henninglange,twitter.com/henninglange,https://angel.co/giant-swarm/jobs,
Old,GigaOM,twitter.com/gigaom,51-200,"Technology news, trends and analysis covering mobile, big data, cloud, science, energy and media.",https://gigaom.com,"San Francisco, CA",USA,they just changed,,,http://jobs.gigaom.com/,
Old,GigSalad,twitter.com/GigSalad,11-50,Marketplace for hiring entertainment,https://www.gigsalad.com/,"Springfield, MO",USA,Mark Steiner,marksdiner,twitter.com/marksdiner,https://gigsalad.workable.com/,
Old,Gigster,twitter.com/trygigster,11-50,Vetted network of top 5% freelancers worldwide,https://gigster.com/,"San Francisco, CA",USA,Roger Dickey,,https://twitter.com/rogerdickey,,
Old,Gistia,twitter.com/GistiaLabs,1-10,Javascript Engineering Experts,http://gistia.com/,"Miami, FL",USA,Carlos Taborda,,https://twitter.com/cartab,http://www.gistia.com/,
Old,Gitbook ,twitter.com/gitbookio,1-10,"GitBook is where you create, write and organize documentation and books with your team.",https://www.gitbook.com/,,USA,Aaron O'Mullan,aaronomullan,twitter.com/aaronomullan,http://jobs.gitbook.com/,
Old,GitHub,twitter.com/github,201-500,GitHub is where people build software,https://github.com/,"San Francisco, CA",USA,Chris Wanstrath,defunkt,twitter.com/defunkt,https://jobs.github.com/,
Old,GitLab,twitter.com/gitlab,11-50,"GitLab includes git repository management, code reviews, issue tracking, wikis and much more.",https://gitlab.com/,"San Francisco, CA",USA,Sytse 'Sid' Sijbrandij,sytses,twitter.com/sytses,https://about.gitlab.com/jobs/,
Old,GitPrime,twitter.com/gitprime,11-50,GitPrime is an analytics platform for software engineering performance,https://www.gitprime.com/,"Durango, CO",USA,Travis Kimmel,traviskimmel,twitter.com/traviskimmel,https://www.gitprime.com/jobs,
Old,Gitter,twitter.com/gitchat,1-10,Where developers come to talk,https://gitter.im/,London,UK,Mike Bartlett,mydigitalself,twitter.com/mydigitalself,http://jobs.gitter.im/,
Old,GlueNetworks ,twitter.com/gluenetworks,11-50,Pioneering the first intelligent automation engine and suite of networking applications,gluenetworks.com/,"Sacramento, Ca",USA,Jeff Gray,,twitter.com/,,
Old,GMB Fitness,twitter.com/gmbfit,11-50,Online fitness training,https://gmb.io,,,Andy Fossett,AndyFossett,twitter.com/AndyFossett,https://gmb.io/hiring/,
Old,Go Fish Digita,twitter.com/gofishdigital,11-50,"Specializing in Online Reputation Management, Search Engine Optimization, ...",gofishdigital.com,"McLean, Virginia ",USA,Brian Patterson,brianspatterson,twitter.com/brianspatterson,http://gofishdigital.com/careers/,
Old,GOFAR,twitter.com/gofarcar,1-10,"We log, score and improve driving beautifully",http://www.gofar.co/,Sydney,Australia,Danny Adams,,,http://www.gofar.co/jobs,
Old,GoHiring,twitter.com/gohiring,1-10,We are a bunch of technology geeks with a strong background in E-Recruitment.,http://www.gohiring.com/,Berlin,Germany,Florian Behn,JonathanDuarte,twitter.com/flobehn,http://www.gohiring.com/jobs.html,
Old,Goodway Group,twitter.com/goodwaygroup,51-200,A managed services programmatic media company,https://goodwaygroup.com/,"Jenkintown, PA",USA,David Wolk,,,https://goodwaygroup.com/careers/,
Old,GotSoccer,twitter.com/GotSoccer,1-10,Soccer's #1 Software Solution,https://home.gotsoccer.com/,"Neptune Beach, FL",USA,Gavin Owen-Thomas,,,,
Old,GovPredict,twitter.com/GovPredict,11-50,"Research, analytics, and actionable intelligence for winning public affairs campaigns",https://govpredict.com/,"Washington, DC",USA,Emil Pitkin,,,,
Old,GrabCAD,twitter.com/grabcad,11-50,world's largest community of mechanical engineers.,https://grabcad.com/,"Cambridge, MA",USA,Hardi Meybaum,,,http://blog.grabcad.com/jobs/,
New,Gradient Metrics,twitter.com/gradientmetrics,1-10,Marketers and technologists that build robust models to guide managers in their decisions.,http://gradientmetrics.com/,"New York, NY",USA,Tom Vladeck,,,,
Old,Gradle,twitter.com/gradle,11-50,"Open Source Build Tool ; Enterprise SaaS and on-premise. Fully remote. Java, Groovy, Kotlin.",https://gradle.com/careers,"San Francisco, CA",USA,Hans Dockter,,https://twitter.com/hans_d,,
Old,GrantStreet,N/A,51-200,Software at your service. ,https://www.grantstreet.com/,US,USA,Myles Harrington,,,https://www.grantstreet.com/careers/,
Old,Grape.io,twitter.com/chatgrapecom,1-10,Big Enterprise Messaging,https://chatgrape.com/,Vienna,Austria,Felix Häusler,felix_hau,twitter.com/felix_hau,https://chatgrape.com/jobs/,
Old,GrapheneDB,twitter.com/graphenedb,1-10,Cloud hosted Neo4j graph databases,http://www.graphenedb.com/,Canary Islands,Spain,Juanjo Andrés,albertoperdomo,,https://remoteok.io/remote-startups/graphenedb,
Old,Grasswire,twitter.com/Grasswire,11-50,The most important news in the world curated and fact-checked by you.,https://grasswire.com,"San Francisco, CA",USA,Austen Allred,AustenAllred,twitter.com/AustenAllred,,
Old,Graylog,twitter.com/graylog2,11-50,Graylog is the leading open source log management platform.,https://www.graylog.org,"Houston, TX",USA,Michael Sklar,michaelsklar,twitter.com/michaelsklar,https://www.graylog.org/jobs/,
Old,Greenback Tax Services,twitter.com/GreenbackTax,11-50,Expat Tax Services,https://www.greenbacktaxservices.com/jobs/,,USA,Carrie McKeegan,,https://twitter.com/cpmckeegan,www.greenbacktaxservices.com,
Old,Gridium,twitter.com/gridium,11-50,SAAS software for buildings,https://gridium.com/,"Menlo Park, CA",USA,Tom Arnold,TheTomArnold,twitter.com/TheTomArnold,https://gridium.com/about/working-at-gridium/,
,Gower St Analytics,twitter.com/gsa_tech,11-50,Improve efficiency of the global theatrical market through data science,https://gower.st,London,UK,Dimitrios Mitsinikos,,,,
Old,Groove,twitter.com/groove,11-50,See why 3000+ businesses have made the switch to the world's simplest help desk. ,https://www.groovehq.com/,"Mill Valley, CA",USA,Ethan Giffin,opie,twitter.com/opie,,
New,Growth Staff,N/A,1-10,We are your VP of Marketing + Entire Growth Team,https://growthstaff.co/,"Phoenix, AZ",USA,,,,,
Old,GuardTime,twitter.com/guardtime,51-200,Data-Centric Security.,https://guardtime.com/,Tallinn,Estonia,Mike Gault,mgault,twitter.com/mgault,https://guardtime.com/about/jobs,
Old,Hanno,twitter.com/wearehanno,1-10,A UX design team building digital products for changemakers,https://hanno.co/,London,UK,Jon Lay,jon_lay,twitter.com/jon_lay,https://github.com/wearehanno/playbook/wiki/New-Hires,
New,Happy Herbivore,twitter.com/happyherbivore,1-10,Help families eat healthier,https://www.getmealplans.com,"Los Angeles, CA",USA,Lindsay and Scott Nixon,,,,
Old,Harris,twitter.com/Harris_Computer,51-200,"Software solutions that offer choice, expertise and relationship",https://www.harriscomputer.com/,"Ottawa, OT",Canada,Jeff Bender,,,,
Old,Harvest,twitter.com/harvest,11-50,"Simple time tracking, fast online invoicing, and powerful reporting software.",www.getharvest.com/,"New York, NY",USA,Danny Wen,dannywen,twitter.com/dannywen,https://www.getharvest.com/careers,
Old,hashi Corp,twitter.com/hashicorp,51-200,Cloud Infrastructure Automation,https://www.hashicorp.com/,"San Francisco, CA",USA,Dave McJannet,,https://twitter.com/davidmcj,https://www.hashicorp.com/,
Old,Hasura,twitter.com/hasurahq,1-10,PaaS/BaaS solution to reuse & deploy code.,http://t.co/fSjMrZmMF4,Bangalore,India,Rajoshi Ghosh,rajoshighosh,twitter.com/rajoshighosh,https://hasura.io/Careers,
New,Hatimeria,twitter.com/hatimeria,1-10,We enable e-commerce businesses to grow while developing tomorrow’s leading e-commerce solutions today.,https://www.hatimeria.com/,Krakow,Poland,Bartosz Zakręta,,,,
Old,Haystack,twitter.com/haystackim,1-10,Search engine for stock photography,https://www.haystack.im/,"New York, NY",USA,Andrew Rowat,andrewrowat,twitter.com/andrewrowat,https://angel.co/haystack-im/jobs,
Old,Hazelcast,twitter.com/hazelcast,11-50,Open source In-Memory Data Grid,https://hazelcast.com/company/careers/,"Palo Alto, CA",USA,Greg Luck,,https://twitter.com/gregrluck,https://hazelcast.com/,
Old,HE:labs,twitter.com/helabs,51-200,Turn your ideas into great products,https://helabs.com/,Rio de Janeiro,Brazil,Rafael Miranda,rafaelmbr,twitter.com/rafaelmbr,https://helabs.recruiterbox.com/,
Old,Health Leads’,twitter.com/HealthLeadsNatl,11-50,Redefine healthcare to include patients’ basic resource needs,https://healthleadsusa.org/about-us/vision/,,USA,Alexandra Quinn,,,https://healthleadsusa.org/about-us/careers/open-positions/,
Old,Healthfinch ,twitter.com/healthfinch,11-50,"We build care redesign apps that alleviate burdensome tasks,",www.healthfinch.com,"Madison, WI",USA,Jonathan Baran,jonathanbaran,twitter.com/jonathanbaran,www.healthfinch.com/careers/,
Old,Heap,twitter.com/heap,11-50,analyze data instantly and retroactively. No shipping code. ,https://heapanalytics.com/,"San Francisco, CA",USA,Matin Movassate,matinm1,twitter.com/matinm1,https://heapanalytics.com/jobs,
Old,Heetch,twitter.com/heetch,51-200,Ride service oriented toward nightlife,http://www.heetch.com/,Paris,France,Teddy Pellerin,teddypellerin,twitter.com/teddypellerin,http://jobs.heetch.com/,
New,HelloMD,twitter.com/mfhadfield,11-50,Largest cannabis health and wellness community.,https://www.hellomd.com/,"San Francisco, CA",USA,Mark Hadfield,,,,
,HelpDocs,twitter.com/HelpDocs,1-10,Build and provide knowledge base software to enterprise companies,https://helpdocs.io,,UK,Jake Peters,,https://twitter.com/jakeapeters,,
Old,Help Scout,twitter.com/helpscout,11-50, A help desk for teams that insist on a delightful customer experience,http://www.helpscout.net,"Boston, MA",USA,Nick Francis,nickfrancis,twitter.com/nickfrancis,http://www.helpscout.net/careers/,
Old,"Helpjuice, Inc.",twitter.com/helpjuice,1-10,Enterprise Knowledge Management SaaS co.,https://helpjuice.com/,Miami - Sarajevo,Serbia,Emil Hajric,emilhajric,twitter.com/emilhajric,,
Old,Heroku,twitter.com/heroku,201-500,PaaS that enables developers to build and run applications entirely in the cloud,https://www.heroku.com/,"San Francisco, CA",USA,Tod Nielsen,,,https://www.heroku.com/careers,
Old,Herox,twitter.com/IamHerox,11-50,HeroX is a two-sided crowdsourcing marketplace ,herox.com,,,,,,,
Old,Hexbridge,twitter.com/hexbridge,1-10,Development Agency for Startups,http://hexbridge.com/,,,Andrei Canta,deiucanta,twitter.com/deiucanta,,
New,HeyTaco!,twitter.com/heytacoapp,1-10,Help people create more vibrant and positive communities.,https://www.heytaco.chat/,MD,USA,Doug Dosberg,,https://twitter.com/dosberg,,
Old,Hippo Education,twitter.com/hippoeducation,11-50,A new-school web based medical education company ,www.hippoed.com,,USA,Aaron Bright,aaronbrightmd,twitter.com/aaronbrightmd,http://www.careers.hippoed.com/,
Old,Hireology,twitter.com/hireology,51-200,Hireology is the leading hiring platform in the franchise and retail automotive industries.,https://www.hireology.com/,"Chicago, IL",USA,Adam Robinson,adrobins,twitter.com/adrobins,www.hireology.com/careers,
Old,HiringThing,twitter.com/hiringthing,1-10,Applicant tracking software,https://www.hiringthing.com/,"Bethlehem, PA ",USA,Joshua Siler,joshuasiler,twitter.com/joshuasiler,https://careers.hiringthing.com/,
New,Hirsh Marketing,https://www.hirshmarketing.com/careers/,1-10,Digital marketing strategy for influencers,https://www.hirshmarketing.com,"Austin, TX",USA,Emily Hirsh,,,,
Old,Hitlist,twitter.com/hitlist_app,1-10,Let us know what you're interested in & we'll bring the best options to you,www.hitlistapp.com,"New York, NY",USA,Gillian Morris,gillianim,twitter.com/gillianim,angel list https://angel.co/hitlist-1/jobs,
New,HoloMeeting,N/A,1-10,Revolutionising Remote Collaboration,https://www.holomeeting.io/,London,UK,,,,,
Old,Holstee,twitter.com/holstee,1-10,Mindful Art Subscription.,https://www.holstee.com/,"New York, NY",USA,David Radparvar,daverad,twitter.com/daverad,https://www.holstee.com/pages/jobs,
Old,Honeybadger,twitter.com/honeybadgerapp,1-10,"Diagnose and fix application errors, faster.",https://www.honeybadger.io/,,USA,Starr Horne,StarrHorne,twitter.com/StarrHorne,angel list,
New,Hopper,twitter.com/hopper,201-500,Revolutionizing how millions of people book their travel,http://www.hopper.com/,"Boston, MA",USA,Frederic Lalonde,,,,
New,Host Compliance,twitter.com/HostCompliance,11-50,Software that makes the sharing economy work for everyone,https://hostcompliance.com/,"San Francisco, CA",USA,Ulrik Binzer,,,,
Old,Hotjar,twitter.com/hotjar,11-50,See how visitors are really using your website,https://www.hotjar.com/,Valletta,Malta,Dr David Darmanin,,twitter.com/daviddarmanin,,
Old,Hubstaff,twitter.com/Hubstaff,1-10,time tracking software with screenshots and activity levels.,https://hubstaff.com/?ab=mv,"Fishers, IN",USA,Dave Nevogt,dnevogt,twitter.com/dnevogt,https://hubstaff.com/jobs,
Old,Hudl,twitter.com/Hudl,201-500,Tools for coaches and athletes to review game footage to improve team play,hudl.com,"Lincoln, NE",USA,David Graff,dghudl,twitter.com/dghudl,http://public.hudl.com/jobs/,
Old,Hugging Face,twitter.com/huggingface_ph,1-10,AI friend ,https://huggingface.co/,"New York, NY",USA,Clement Delangue,,twitter.com/ClementDelangue,,
Old,Hugo,twitter.com/hugo_events,1-10,Hugo is to events what Tripadvisor is to hotels.,https://www.hugo.events/en,Amsterdam,Netherlands,Guy Kessels,,,https://www.hugo.events/en/careers,
Old,Human,twitter.com/human,1-10,Human is a free all-day activity tracker,http://human.co/,"San Francisco, CA",USA,Paul Veugen,pveugen,twitter.com/pveugen,angel list,
Old,Human Made,twitter.com/humanmadeltd,1-10,WordPress Development,https://hmn.md/,UK,UK,Tom Willmot,tomwillmot,twitter.com/tomwillmot,https://hmn.md/is/hiring/,
Old,Iambnb,twitter.com/official_iambnb,11-50,Enabling homeowners to earn additional income,http://www.iambnb.nl/,Amsterdam,Netherlands,Antoine Dumas-Martin,donidude,twitter.com/donidude,https://iambnb.recruiterbox.com/,
New,Ibotta,twitter.com/IbottaApp,11-50,"Save consumers time and money, by creating a single starting point for all rewarded shopping.",https://ibotta.com/,"Denver, CO",USA,,,,,
Old,ICUC,twitter.com/icuc,501-1000,Social media management services company ,www.icuc.social/,"Winnipeg, Manitoba ",Canada,Keith Bilous,keithbilous,twitter.com/keithbilous,icuc.social/careers-icuc,
New,Idego Group,N/A,11-50,Premium Software House,https://idego-group.com/,Berlin,Germany,Krzysztof Gibas,,,,
Old,iDoneThis,twitter.com/idonethis,1-10,Provides the strongest insights of what you and your team have done for the day or week.,https://home.idonethis.com,"Las Vegas, NV",USA,Walter Chen,smalter,twitter.com/smalter,https://remoteok.io/remote-startups/idonethis,
Old,Igalia ,twitter.com/igalia,11-50,Open source consultancy specialized in the development of innovative projects ,http://www.igalia.com/,"Coruña, Galicia ",Spain,,,,,
Old,iMedicare,twitter.com/iMedicare,11-50,"We service thousands of pharmacies across the US,",https://imedicare.com,"New York, NY",USA,Flaviu Simihaian,flaviusim,twitter.com/flaviusim,https://imedicare.com/jobs/,
Old,Import2,twitter.com/importto,1-10,"Simple, easy-to-use data import tool ",https://www.import2.com,"Sunnyvale, CA",USA,Mark Kofman,markkofman,twitter.com/markkofman,angel list,
Old,Incsub,twitter.com/incsub,11-50,We are behind WordPress projects WPMU DEV and Edublogs,incsub.com/,"Albert Park, Victoria",USA,James Farmer,jamesfarmer,twitter.com/jamesfarmer,http://incsub.com/careers/,
Old,Indie Localizers,twitter.com/IndieLocalizers,11-50,"We are hiring: SEOs, devs, testers",indielocalization.com,"Jersey City, NJ",USA,Artem Nedrya,,twitter.com/T9n_Design,,
New,InFlight,N/A,11-50,Modernize your existing systems,https://www.inflightintegration.com,"Easthampton, MA",USA,Ian McDonald,,,,
Old,Influx,twitter.com/influxdotcom,51-200,Outsourced customer support.,https://influx.com/,Melbourne,Australia,Leni Mayo,lenidot,twitter.com/lenidot,https://influx.com/careers,
Old,InfluxData,twitter.com/influxdb,11-50,"Data platform for sensors, machines and IoT.",https://www.influxdata.com/,"San Francisco, CA",USA,Evan Kaplan,evankaplan,twitter.com/evankaplan,https://www.influxdata.com/careers/,
New,INN Labs,twitter.com/INNnerds,1-10,Institute for Nonprofit News,https://labs.inn.org/nerds/,"Denver, CO",USA,Kay Lima,,twitter.com/kayleen_lima,,
New,Innolitics,twitter.com/innolitics,11-50,Medical imaging,https://innolitics.com/,"New York, NY",USA,John Giese,,,,
Old,Inpsyde GmbH ,twitter.com/inpsyde_gmbh,11-50,Enterprise solutions with the world's most popular open-source CMS,http://inpsyde.com/en/,Gladbach ,USA,Olaf A. Schmitz / co founder,bueltge,twitter.com/bueltge,email inquiry on their main page,
New,Input,twitter.com/input,1-10,One place for your most important work,https://www.input.com/,"San Francisco, CA",USA,Garrett Camp,,,,
Old,Inspired HR,twitter.com/InspiredHRltd,1-10,"Greatest impact on workplace productivity, employee engagement & risk mitigation",inspiredhr.ca/,,USA,Debby Carreau ,DebbyCarreau,twitter.com/DebbyCarreau,http://inspiredhr.mytribehr.com/careers,
New,Instinct Science,N/A,1-10,Helps veterinary hospitals ,https://www.instinct.vet/,"Philadelphia, PA",USA,Caleb Frankel,,,,
Old,Instructure,twitter.com/Instructure,501-1000,Makes software that makes people smarter.,https://www.instructure.com/,"Salt Lake City, UT",USA,Josh Coates,,,https://www.instructure.com/careers/,
Old,Intellum,twitter.com/intellum,11-50,"Intellum provides web based learning management system software, custom courseware",http://www.intellum.com/,"Atlanta, GA",USA,Chip Ramsey,,,https://intellum-inc.workable.com/,
Old,Interactive Intelligence,twitter.com/IN_Intelligence,501-1000,Interactive Intelligence provides software and cloud services for customer engagement,https://www.inin.com/,"Indianapolis, IN",USA,Donald E Brown,donbrownindy,twitter.com/donbrownindy,https://www.inin.com/careers,
Old,Intercom,twitter.com/intercom,201-500,"Intercom is a fundamentally new way for internet businesses to communicate with customers,",https://www.intercom.com/,"San Francisco, CA ",USA,Eoghan McCabe,eoghanmccabe,twitter.com/eoghanmccabe,https://www.intercom.com/careers,
Old,Interfolio,twitter.com/Interfolio,11-50,The first ever faculty information system.,https://www.interfolio.com/,"Washington, DC",USA,Andrew Rosen,,,,
Old,Intridea/Mobomo,twitter.com/mobomoapps,11-50,"Strategists, designers, developers & creators: this is who we are. ",http://www.intridea.com/,"Washington, DC",USA,Marc Garrett,since1968,twitter.com/since1968,http://jobs.intridea.com/,
Old,INTUO,twitter.com/intuotalent,11-50,Talent Management System,https://www.intuo.io/,Ghent,Belgium,Tim Clauwaert,clauwaerttim,twitter.com/clauwaerttim,https://angel.co/intuo/jobs,
New,InukaInuka,twitter.com/inuka_io,1-10,Wellbeing support from a personal coach,https://www.inuka.io/,Nairobi,Kenya,,,,,
