Old,Network Ninja,twitter.com/networkninja,11-50,Customizable Management Software,https://networkninja.com/,"Chicago, IL",USA,Matthew Bochneak,mattbochneak,twitter.com/mattbochneak,https://networkninja.com/jobs/,
Old,New Context,twitter.com/newcontext,11-50,New Context specialize in Lean Security,https://www.newcontext.com/,"San Francisco, CA ",USA,Daniel Riedel,riedelinc,twitter.com/riedelinc,https://www.newcontext.com/careers/,
New,NEX,N/A,1-10,We make it easy to trade and manage digital assets,http://www.nexopportunities.com/about,London,UK,Steve Gibson,,,,
Old,Next Big Sound ,twitter.com/nextbigsound,11-50,Analytics and Insights for the Music Industry.,https://www.nextbigsound.com/,"New York, NY ",USA,Alexander S. White,mralexwhite,twitter.com/mralexwhite,http://pandora.com/careers/product-technology,
Old,NIFTIT,twitter.com/NIFTIT,11-50,We build all things digital.,https://niftit.com/,"New York, NY",USA,Khoa Quach,niftykhoa,twitter.com/niftykhoa,https://niftit.recruiterbox.com/,
New,NinjaCat,twitter.com/NinjaCatPPC,1-10,All-in-one reporting solution for leading digital marketing agencies,https://www.ninjacat.io/,"New York, NY",USA,Paul Deraval,,,,
Old,Niteoweb,twitter.com/niteoweb,1-10,Employing tech enthusiasts from all over the world who love to build cool stuff.,https://www.niteoweb.com/careers,Ljubljana,Slovenia,Necj Zupan,,https://twitter.com/nzupan,https://www.niteoweb.com/careers,
Old,NodePing,twitter.com/nodeping,1-10,Server monitoring service,https://nodeping.com/,AZ,USA,Shawn Parrish,shawnpar,twitter.com/shawnpar,,
Old,NodeSource ,twitter.com/NodeSource,11-50,"Node.js Support, Training and Consulting for the Enterprise, Worldwide.",https://nodesource.com,,USA,Joe McCann,joemccann,twitter.com/joemccann,angel list,
Old,NodeSWAT,twitter.com/nodeSWAT,1-10,Our software takes your business to a new level. ,https://www.nodeswat.com/,Tallinn,Estonia,Rait Ojasaar,raitens,twitter.com/raitens,angel list,
New,Noiiz,twitter.com/noiizinc,1-10,Better touch experience for your content,https://www.noiiz.com/,Freiburg,Switzerland,Dennis Willener,,,,
New,Nomics,twitter.com/nomicsfinance,1-10,cryptocurrency & bitcoin (market data) API ,https://nomics.com/,"Minneapolis, MN",USA,Clay Collins,,twitter.com/ClayCollins,,
Old,NoRedInk,twitter.com/noredink,11-50,Online grammar software,https://www.noredink.com/,"San Francisco, CA",USA,Jeff Scheur,jscheur,twitter.com/jscheur,https://www.noredink.com/jobs,
Old,Notepad Studio,twitter.com/notepadstudio,1-10,Brand agency based largely in Birmingham with a satellite office in London,http://notepadstudio.com,London,UK,Naeem Alvi,,N/A,,
Old,Novoda,twitter.com/novoda,51-200,Novoda specialise in developing high quality Android & iOS platform software,https://www.novoda.com/,London,UK,Kevin (Bryden) McDonagh,kevinmcdonagh,twitter.com/kevinmcdonagh,https://www.novoda.com/hiring,
New,NovuHealth,twitter.com/novuhealth,11-50,Consumer health engagement company,https://www.novu.com/,"Minneapolis, MN",USA,Jim Wicka,,,,
Old,Nugg,twitter.com/GetNugg,11-50,On Demand Cannabis Marketplace,https://www.getnugg.com/,"Los Angeles, CA",USA,Kam Babazade,,,www.getnugg.com,
Old,Numbrs,twitter.com/Numbrs,51-200,customer-centric financial services company,https://www.centralway.com/uk/careers/open-positions,Zurich,Switzerland,Oyvind Oanes,,https://twitter.com/OyvindOanes,https://www.centralway.com/uk/careers/open-positions,
Old,nVisium,twitter.com/invisium,11-50,Application security services and products,https://nvisium.com/,"Herndon, VA",USA,Jack Mannino,jack_mannino,twitter.com/jack_mannino,https://nvisium.com/careers/,
New,NymCard,twitter.com/NymCard,201-500,Mobile payment experience,https://www.nymcard.com/,Beirut,Lebanon,Omar Onsi,,,,
Old,O'Reilly Media,twitter.com/oreillymedia,201-500,Publishes and shares information and knowledge on computer tech topics.,http://www.oreilly.com/,"Sebastopol, CA",USA,Tim O'Reilly,timoreilly,twitter.com/timoreilly,http://www.oreilly.com/jobs/,
Old,Octopus Deploy,twitter.com/OctopusDeploy,11-50,most popular deployment automation server in the world,https://octopus.com/company,"Birsbane, QLD",Australia,Paul Stovell,,https://twitter.com/paulstovell,https://octopus.com/company,
New,Oddball,twitter.com/oddballio,1-10,high-end boutique dev shop,https://oddball.io/,"Los Angeles, CA",USA,Travis Sorensen,,,,
Old,Oh My George,twitter.com/ohmygeorgeapp,1-10,a CandyCrush-style financial trading platform,www.ohmygeorge.com,Bangkok,Thailand,Lucien Tavano,,,,
Old,OK GROW!,twitter.com/ok_grow,11-50,Web and mobile app development in Toronto,https://www.okgrow.com/,Toronto,Canada,Paul Dowman,pauldowman,twitter.com/pauldowman,https://www.okgrow.com/join-us,
Old,Olark,twitter.com/olark,11-50,Over 10000 companies rely on Olark live chat to answer customers,https://www.olark.com,"San Francisco, CA",USA,Ben Congleton,jaminben,twitter.com/jaminben,https://www.olark.com/jobs,
Old,Olo,twitter.com/olo,51-200,Online Ordering for Restaurants,http://www.olo.com/,"New York, NY",USA,Noah Glass,nhglass,twitter.com/nhglass,http://www.olo.com/company/#careers,
New,OmniAccess,twitter.com/OmniAccess,11-50,World-leading enterprise in high-end VSAT airtime services,https://www.omniaccess.com/,Palma de Mallorca,Spain,Bertrand Hartman,,,,
New,OneSky,twitter.com/oneskyapp,11-50,Full-stack Localization Solution,http://www.oneskyapp.com/,Hong Kong,HK,Greg Sung,,,,
Old,OnTheGoSystems,twitter.com/onthego_systems,51-200,We are the makers of WPML the famous WordPress Multilingual plugin,https://www.onthegosystems.com/,Hong Kong,HK,Eyal Kaufman,EyalKaufman,twitter.com/EyalKaufman,https://www.onthegosystems.com/jobs/,
Old,Onyo,N/A,1-10,"Brazilian first national food pickup marketplace, focusing on food courts.",https://www.site.onyo.com/,,Brazil,Alexandre Dinkelman,,,,
Old,Open Knowledge,twitter.com/okfn,11-50,Projects around opening up data and knowledge ,https://okfn.org/,,,Pavel Richter,pavel,twitter.com/pavel,https://okfn.org/about/jobs/,
Old,OpenCraft,twitter.com/opencraft,11-50,OpenCraft sets up an instance to allow you to host your MOOC on your own terms. ,opencraft.com,Giza,USA,Xavier Antoviaque,antoviaque,twitter.com/antoviaque,,
Old,openredis,twitter.com/openredis,1-10,Dependable Redis Hosting,https://openredis.com/,"Los Angeles, CA",USA,Cyril David,cyx,twitter.com/cyx,,
Old,Optimal,twitter.com/optimaldm,1-10,internet marketing company based in the midwest,https://optimal-digital-marketing.workable.com/,"Appleton, WI",USA,,,,http://optimal.marketing/,
Old,Optimile NV,twitter.com/OptimileEU,1-10,software house that creates Mobility as a Service,https://www.optimile.eu/about-us,Ghent,Belgium,,,,www.optimile.eu/jobs,
Old,Origin Eight ,twitter.com/origineight,11-50,Origin Eight is dedicated to the artful integration of usable design & technology,https://origineight.net/,"Minneapolis, MN",USA,Seth Viebrock,sethviebrock,twitter.com/sethviebrock,https://origineight.recruiterbox.com/,
Old,Outbank,twitter.com/outbank,11-50,Mobile banking,https://outbankapp.com/,Dachau,Germany,Tobias Stöger,tstoegi,twitter.com/tstoegi,https://outbankapp.com/jobs/,
New,OutMatch,twitter.com/OutMatchHCM,11-50,Talent Selection People Development,https://outmatch.com/,"Dallas, TX",USA,Greg Moran,,,,
,Overleaf,twitter.com/overleaf,11-50,Google Docs for Science - online collaborative LaTeX editor,https://www.overleaf.com/,London,UK,John Hammersley,,https://twitter.com/DrHammersley,,
Old,Overl.ai,twitter.com/overlai,11-50,Healthcare workflow automation,https://overl.ai/,"New York, NY",USA,Alex Zoller,alexzoller,twitter.com/alexzoller,https://angel.co/overlai/jobs,
Old,owl power,twitter.com/owlp_eu,1-10,"WordPress maintenance services, business apps",https://owlpower.eu,Brasov,Romania,Csaba Miklós,csaby_miklos,twitter.com/csaby_miklos,https://osda.eu/jobs/company/9/,
Old,Owsy,N/A,1-10,CREATING PRODUCTS FOR FINANCIAL SERVICES FIRMS.,http://owsy.com/,"Venice, CA",USA,Cristian Joe (only guy we find),MrCristianjoe,twitter.com/MrCristianjoe,http://owsy.com/careers/,
New,Pachama,N/A,1-10,Trusted forest carbon credits.,https://www.pachama.com,"San Francisco, CA",USA,DIEGO SAEZ GIL,,,,
New,Pactly,twitter.com/pactlyai,1-10,Understand your contracts instantly,https://pactly.ai/,Singapore,Singapore,Ivan Rawtaer,,,,
Old,PageFreezer Software ,twitter.com/PageFreezer,11-50,Website & Social Media Archiving for Compliance & eDiscovery,https://www.pagefreezer.com/aboutus/careers/,"Vancouver, BC",Canada,Michael Riedijk,,https://twitter.com/mriedijk,https://pagefreezer-software-inc.breezy.hr/,
Old,Pagely,twitter.com/Pagely,11-50,Help World's Biggest Brands Scale WordPress,https://pagely.com/,"Phoenix, AZ",USA,Joshua Strebel,strebel,twitter.com/strebel,https://pagely.com/careers/,
Old,Paktor,twitter.com/GoPaktor,11-50,Making Meaningful Connections,www.gopaktor.com,Singapore,Singapore,Jingshen Ng,,,https://www.techinasia.com/companies/paktor,
New,Palo Alto Insight,N/A,1-10,"Machine learning services for manufacturing, ecommerce, and financial services",https://www.paloaltoinsight.com/english/,"San Francisco, CA",USA,Tomoe Ishizumi,,,,
New,Pandable,twitter.com/pandableco,1-10,We make things happen,https://pandable.co/,London,UK,Lucy Kirkness,,,,
New,Parablesoft,N/A,1-10,Software consultancy,http://parablesoft.com/,"Tampa, FL",USA,,,,,
Old,ParcelBright,twitter.com/ParcelBright,1-10,offers low UK & International parcel delivery rates with an easy booking system,https://www.parcelbright.com/,London,UK,Daniel Lipinski,,,https://www.parcelbright.com/careers,
Old,Parse.ly,twitter.com/parsely,11-50,partners with digital publishers to provide clear audience insights ,www.parsely.com/,"New York, NY",USA,Sachin Kamdar,SachinKamdar,twitter.com/SachinKamdar,http://www.parsely.com/jobs/,
,PartnerHero,twitter.com/partnerhero,201-500,Global support for your startup.,https://partnerhero.com/,"Boise, ID",USA,Shervin Talieh,,twitter.com/calitalieh,,
Old,Particular Software,twitter.com/particularsw,11-50,The Particular Service Platform brings powerful capabilities to your application lifecycle. ,http://particular.net/,Haifa ,Israel,Udi Dahan,UdiDahan,twitter.com/UdiDahan,http://particular.net/careers,
Old,"Pasilobus, Inc",twitter.com/pasilobushq,1-10,We code to make commerce better,https://pasilobus.recruiterbox.com/,,USA,Uğurcan Kaya,,,https://www.pasilobus.com,
New,Passel,twitter.com/passel_io,1-10,Privacy and security tools made easy,https://passel.io/,"New Jersey, NJ",USA,Peter DiPreta,,,,
Old,Patients Know Best,twitter.com/patientsco,11-50,Patient-controlled medical records.,https://www.patientsknowbest.com/,Cambridge,UK,Mohammad Al-Ubaydli,idiopathic,twitter.com/idiopathic,https://www.patientsknowbest.com/careers.html,
Old,Paylocity ,twitter.com/Paylocity,1001-5000,Elevate the profession of Payroll and Human Resources,www.paylocity.com/,"Heights, IL",USA,Steven Raymond Beauchamp,,,http://www.paylocity.com/careers/,
Old,Paylock,N/A,11-50,Offers a suite of parking management services,https://paylock.com/jobs/,"New Jersey, NJ",USA,Cory Marchasin,,,http://paylock.com/jobs/,
New,Payroll Panda,N/A,1-10,Cloud payroll for South-East Asian Businesses,https://www.payrollpanda.my/,Kuala Lumpur,Malaysia,Asim Qureshi,,,,
Old,Peak Games,twitter.com/peakgames/,201-500,We scale games that host tens of thousands of concurrent users.,https://peak.games/,Istanbul,Turkey,Sidar Sahin,,https://twitter.com/sidars,https://peak.games/job,
Old,Peerfit,twitter.com/peerfit,11-50,Redefine Wellness at Work,https://pulse.peerfit.com/hiring/,CA,USA,Ed Buckley,,https://twitter.com/edbucklll,https://pulse.peerfit.com/hiring/,
Old,PeopleDoc,twitter.com/peopledoc_inc,51-200,HR Service Delivery in the Cloud,https://www.people-doc.com/company/careers,Paris,France,Jonathan Benhamou,,https://twitter.com/johnbenhamou,https://www.people-doc.com/company/careers,
Old,PeopleG2,twitter.com/peopleG2,51-200,Risk Management solutions specialized for the Human Capital world,www.peopleg2.com/,"Brea, CA",USA,Chris Dyer,chrisdyer7,twitter.com/chrisdyer7,http://www.peopleg2.com/about/careers-at-peopleg2/,
Old,Percona,twitter.com/Percona,51-200,Open Source Database Software and Services Expertise.,percona.com/about-percona,"Raleigh, NC",USA,Peter Zaitsev,,twitter.com/PeterZaitsev,,
New,Perfect Keto,twitter.com/perfectketones,1-10,"Low carb, high growth",https://perfectketo.com/,"Austin, TX",USA,,,,,
Old,PersistIQ,twitter.com/persistiq,1-10,The Smart Outbound Sales Platform,https://jobs.lever.co/persistiq,"San Mateo,CA",USA,Pouyan Salehi,,https://twitter.com/psalehi,https://jobs.lever.co/persistiq,
New,Piggy,twitter.com/JoinPiggy,11-50,The easiest way to SAVE!,https://www.joinpiggy.com/,Florida,USA,John Anderson,,,,
Old,Pindrop,twitter.com/pindrop,201-500,Voice fraud prevention & authorization.,http://pindrop.com,"Atlanta, GA",USA,Vijay Balasubramaniyan,vijay_voice,twitter.com/vijay_voice,https://www.pindrop.com/pindrop-careers/,
New,Pinn,twitter.com/pinntech,11-50,Develops technologies to solve the most complex digital identity challenges ,http://www.pinn.ai/,"Redwood city, CA",USA,Will Summerlin,,,,
Old,Pipedrive,twitter.com/pipedrive,51-200,Sales pipeline software that gets you organized. ,https://www.pipedrive.com/,"New York, NY",USA,Timo Rein,timorein,twitter.com/timorein,https://www.pipedrive.com/en/jobs,
New,Pitch,twitter.com/pitch,1-10,An open platform for presentations and content collaboration,https://pitch.com/,Berlin,Germany,Christian Reber,,,,
Old,Pivotal Labs,twitter.com/pivotallabs,1001-5000,Pivotal Labs delivers results in mobile like no one else in their business,pivotal.io/labs,"San Francisco, CA ",USA,Edward Hieatt,edwardhieatt,twitter.com/edwardhieatt,http://pivotal.io/careers,
Old,Pixel2HTML,twitter.com/pixel2html,11-50,Front-End Development Company,https://pixel2html.com,Buenos Aires,Argentina,Diego Alejandro Peralta,,,http://pixel2html.com/jobs.html,
New,PixelHaus Media,twitter.com/pixelhausmedia,1-10,Advertising and growth agency helping brands achieve sky-high ROI.,www.pixelhaus.media,Amsterdam,The Netherlands,Mirella Crespi,,twitter.com/mirellacrespi,,
New,Pixels for Humans,twitter.com/pixelsforhumans,11-50,Work with SaaS startups to create intentional businesses that care,https://measured.pixelsforhumans.com/,"Boston, MA",USA,,,,,
Old,Planet OS,twitter.com/planet_os,11-50,Designed to streamline complex data workflows,https://planetos.com,"Sunnyvale, CA",USA,Rainer Sternfeld,rsternfeld,twitter.com/rsternfeld,https://planetos.com/jobs/,
Old,Platform.sh,twitter.com/platformsh,11-50,CONTINUOUS DEPLOYMENT CLOUD HOSTING,https://platform.sh/,Paris,France,Fred Plais,fredplais,twitter.com/fredplais,https://platform.sh/company/jobs/,
Old,Plex,twitter.com/plex,51-200,Your media on all your devices,https://www.plex.tv/,Stans,Switzerland, Keith Valory,jason_blessing,twitter.com/kvalory,https://www.plex.tv/about/careers/,
New,Pond5,twitter.com/pond5,51-200,Help filmmakers fulfill their creative vision.,http://www.pond5.com/,"New York, NY",USA,Jason T. Teichman,,,,
Old,Postlight,twitter.com/postlightstudio,11-50,Builds and designs apps for web and mobile.,https://postlight.com/?,"New York, NY",USA,Paul Ford,ftrain,twitter.com/ftrain,https://postlight.recruiterbox.com/,
,Podia,twitter.com/podia,1-10,"Sell memberships, online courses, and digital downloads to your audience",podia.com,"New York, NY",USA,Spencer Fry,,twitter.com/spencerfry,,
New,Postmark,twitter.com/postmarkapp,1-10,"Delivers your transactional email to customers on time, every time.",https://postmarkapp.com/,"Philadelphia, PA",USA,,,,,
New,Power Diary,twitter.com/MyPowerDiary,1-10,Provide health practitioners with the ultimate Practice Management Software,https://www.powerdiary.com/,"Ballarat Central, Victoria",Australia,Damien Adler,,,,
Old,Precision Nutrition,twitter.com/insidePN,51-200,Online nutrition and fitness coaching,http://www.precisionnutrition.com/,Toronto ,Canada,Phil Caravaggio,philcaravaggio,twitter.com/philcaravaggio,http://www.precisionnutrition.com/careers,
Old,Pressable,twitter.com/pressable,1-10,Where WordPress Works Best,pressable.com,"San Antonio, TX",USA,Jeff Mulholland,,https://twitter.com/jeffmulholland,https://pressable.com/careers/,
Old,PreviousNext,twitter.com/previousnext,1-10,Australian based Drupal agency.,https://www.previousnext.com.au/about/careers,Sydney,Australia,,,,https://www.previousnext.com.au/about/careers,
Old,Prezly,twitter.com/Prezly,1-10,Connect your content with your influencers.,https://www.prezly.com/careers,,Belgium,Gijs Nelissen,,https://twitter.com/digitalbase,https://www.prezly.com/careers,
New,Proactive Digital Insights,twitter.com/ProactiveDI,1-10,Augment and amplify the impact of Home Instead Senior Care,https://www.proactivedigitalinsights.com/,"Omaha, NE",USA,Tom T. Shen,,,,
Old,Product Hunt,twitter.com/ProductHunt,11-50,"A curation of the best new products, every day",http://producthunt.com/,"San Francisco, CA",USA,Ryan Hoover,rrhoover,twitter.com/rrhoover,https://www.producthunt.com/jobs,
Old,Productive Power,N/A,1-10,Help professionals master their digital lives so they can achieve their greatest potential.,http://productivepower.applytojob.com/,"Miami, FL",USA, Brett Spodak,,https://twitter.com/BSpodak,http://productivepower.applytojob.com,
Old,Proemion,twitter.com/Proemion,51-200,Telematics Solutions for industrial applications,https://career.proemion.com/en/jobs.html,,Germany,Robert Michaelides,,,https://www.proemion.com/,
New,ProFinda,twitter.com/profinda,1-10,"Maps the skills, knowledge and expertise available across an organisation's talent",https://www.profinda.com/,London,UK,Roger Gorman,,,,
Old,Protocol Labs,twitter.com/protocollabs,11-50,Develops IPFS and Filecoin.,http://ipn.io/,"Palo Alto, CA",USA,Juan Benet,juanbenet,twitter.com/juanbenet,https://angel.co/protocol-labs/jobs,
New,PSPDFKit,twitter.com/PSPDFKit,11-50,The Best Way to Handle PDF Documents on any platform.,https://pspdfkit.com/,Vienna,Austria,Peter Steinberger,,,,
New,Punchpass,twitter.com/Punchpass,1-10,Help small fitness studios manage their customers,https://punchpass.com/,Vermont,USA,Chris Patton,,,,
Old,Puppet Labs,twitter.com/puppetize,201-500,Puppet Labs is an information technology automation software company,https://puppet.com/,"Portland, OR",USA,Sanjay Mirchandani,mirchi111,twitter.com/mirchi111,https://puppet.com/company/careers,
Old,Purepoint,N/A,1-10,Innovative software that solves big business problems,https://purepoint.io/,London,UK,Freddie Smith,,,,
Old,Purple Voice,twitter.com/purplevoiceltd,1-10,Mobile application development,https://www.purplevoice-web.design,Bangkok,Thailand,Raphael TANT,,,https://www.purplevoice-web.design/jobs.html,
New,Qikker Online,twitter.com/QikkerOnline,1-10,Qikker Online is a fast-growing digital agency,https://www.qikkeronline.nl/,Amsterdam,The Netherlands,Michiel Willekens ,,,,
Old,Quantum Mob,twitter.com/quantummob,1-10,Software Consulting,http://www.quantummob.com/,Toronto,Canada,Erich Reich,ReichErich,twitter.com/ReichErich,http://www.quantummob.com/careers/,
Old,Quartzy,twitter.com/Quartzy,11-50,Helping scientists discover the future,https://www.quartzy.com/about,"Palo Alto, CA",USA,Jayant Kulkarni,,https://twitter.com/jkulki,https://www.quartzy.com/careers,
Old,Rackspace,twitter.com/Rackspace,1001-5000,Public Cloud Infrastructure ,https://rackspace.jobs/remote/none/usa/jobs/software-development/new-jobs/,"San Antonio, TX",USA,Joe Eazor,,https://twitter.com/joe_eazor,https://rackspace.jobs/,
Old,railroad19,N/A,11-50,Custom Software And Cloud Platform Needs.,https://www.railroad19.com/#careers,"Saratoga Springs, NY",USA,John Luttmer,,,https://www.railroad19.com/#careers,
Old,Railsformers,twitter.com/railsformers,11-50,We have been programming with Ruby on Rails,https://railsformers.com/,Ostrava,Czech Republic,Jiri Kubica,jirikubica,twitter.com/jirikubica,https://angel.co/railsformers,
Old,RainforestQA,twitter.com/rainforestqa,11-50,Quality Assurance as a Service,https://www.rainforestqa.com/,"San Francisco, CA",USA,Fred Stevens-Smith,fredsters_s,twitter.com/fredsters_s,https://www.rainforestqa.com/jobs/,
Old,Raising the floor,twitter.com/RaisingTheFloor,11-50,Evolving the GPII to make IT access simpler and more affordable for everyone,https://raisingthefloor.org/,,,,,,,
Old,RaRe Technologies,twitter.com/raretechteam,1-10,Where cutting edge data science meets robust engineering.,https://rare-technologies.com/,,Czech Republic,Radim Řehůřek,RadimRehurek,twitter.com/RadimRehurek,https://rare-technologies.com/careers/,
Old,Reaction Commerce,twitter.com/getreaction,11-50,"Open source ecommerce platform. Node.js, MongoDB, Kubernetes, Docker.",https://reactioncommerce.com/about,"Los Angeles, CA",USA,Sara Hicks,,https://twitter.com/saralouhicks,https://reactioncommerce.com/,
Old,Real HQ,twitter.com/realhq,51-200,Maker of Agent Pronto,https://realhq.com/jobs/,"Austin, TX",USA,Dave Peters,,,https://realhq.com/jobs/,
Old,Receiptful,twitter.com/receiptful,11-50,Receiptful is an API that enables its users to send beautiful emails,https://receiptful.com/,London,UK,Adii Pienaar,adii,twitter.com/adii,https://angel.co/receiptful,
Old,ReCharge,twitter.com/RechargePayment,11-50,empower stores by making payments easy for everyone.,https://rechargepayments.com/about,"Santa Monica, CA",USA,Oisin O'Connor,,,https://rechargepayments.com/about,
New,Recognize Services,N/A,11-50,"Helping companies communicate company values, while retaining top employees.",https://recognizeapp.com/,"Oakland, CA",USA,,,,,
Old,Recruiterbox,twitter.com/recruiterbox,11-50,Recruitment software,http://recruiterbox.com/,"San Francisco, CA ",USA,Raj Sheth,whoisraj,twitter.com/whoisraj,http://recruiterbox.com/company/about-us/#careers,
Old,Recurly,twitter.com/recurly,51-200,Recurring billing management for subscription-based businesses,https://recurly.com/,"San Francisco, CA ",USA,Dan Burkhart,,,https://angel.co/recurly,
Old,Red Guava,twitter.com/redguava,11-50,"Smart people, Simple software",http://www.redguava.com.au/,"Melbourne, VIC",Australia,Liora,,,,
Old,Red Hat,twitter.com/RedHatNews,1001-5000,Open source software company,https://www.redhat.com,"Raleigh, North Carolina",USA,James M. Whitehurst,JWhitehurst,twitter.com/JWhitehurst,https://www.redhat.com/en/jobs,
Old,Redox,twitter.com/Redox,11-50,Redox is the modern API for healthcare,https://www.redoxengine.com/careers,"Madison, WI",USA,Niko Skievaski,,https://twitter.com/niko_ski,https://www.redoxengine.com/careers,
Old,Reinteractive,twitter.com/reinteractive,11-50,Confident software with Ruby on Rails and JavaScript,https://reinteractive.com/,Sydney,Australia,Mikel Lindsaar,lindsaar,twitter.com/lindsaar,,
Old,Relayto,twitter.com/relayter,1-10,Interactive & measurable document experience,https://relayto.com/,London,UK,Alex Shevelenko ,shevelenko,twitter.com/shevelenko,https://relayto.com/careers,
Old,RemoteYear,twitter.com/remoteyear,11-50,A foundation for professionals to work & explore the world as part of a vibrant global community. ,remoteyear.com,,USA,Greg Caplan,,twitter.com/gdcaplan,,
Old,RepeaterStore,twitter.com/repeaterstore,1-10,Improve cell phone reception inside buildings,https://www.repeaterstore.com/,"Laguna Hills, CA",USA,Brendan Gill,Brendan_Gill,twitter.com/Brendan_Gill,,
Old,Replay Gaming,twitter.com/replaygamesinc,1-10,Fast growing UK social gaming company that operates Replay Poker ,https://www.replaygamesinc.com/,London,UK,Paul Trowe,,https://twitter.com/ptrowe,https://replaygaming.recruiterbox.com,
Old,resin.io,twitter.com/resin_io,11-50,DevOps for IoT,https://resin.io/,"Seattle, WA",USA,Bryan Hale,halebr,twitter.com/halebr,https://resin.workable.com/,
Old,Restorepoint,twitter.com/restorepoint,11-50,"Disaster Recovery, Automation and Compliance for Networks",http://www.restorepoint.com,"Woking, Surrey",UK,Riccardo Valente,,N/A,,
Old,retail-zipline,twitter.com/retailzipline,1-10,"Built by Retail, for Retailers",https://retailzipline.com/about.html,"Vancouver, BC",Canada,Melissa Wong,,https://angel.co/melissa-wong-4,https://retailzipline.com/about.html,
Old,RetailNext,twitter.com/RetailNext,51-200,Analytics for physical retail stores.,http://retailnext.net/en/home/,"San Jose, CA",USA,Alexei Agratchev,agratchev,twitter.com/agratchev,http://retailnext.net/en/about-us/career-openings/,
New,Retrospect,twitter.com/retrospectinc,11-50,Retrospect develops backup software for small businesses,http://www.retrospect.com/,"Wallnut Creek, CA",USA,JG Heithcock,,https://twitter.com/jgheithcock,,
New,Revolution Messaging,twitter.com/revmsg,11-50,Full service digital agency fighting for progressive causes.,https://revolutionmessaging.com/,"Washington, DC",USA,Scott Goodstein,,,,
Old,RightScale,twitter.com/rightscale,11-50,Save money. Streamline operations.,https://www.rightscale.com/jobs,"Santa Barbara, CA",USA,Jonathan Siegel,,https://twitter.com/usiegj00,https://www.rightscale.com/,
Old,rmotr.com,twitter.com/rmotr_com,1-10,Remote programming courses and workshops,https://rmotr.com/,,,Santiago Basulto,santiagobasulto,twitter.com/santiagobasulto,https://angel.co/rmotr-com,
Old,Roadtrippers,twitter.com/roadtrippers,51-200,"Travelers can seamlessly discover, plan & book their next trip, all in one place",http://jobs.roadtrippers.com/apply/,"Cincinnati, OH",USA,james fisher,,https://twitter.com/bantheinternet?lang=en,http://jobs.roadtrippers.com/apply/,
Old,Rocana,twitter.com/rocanainc,51-200,Rocana is the next generation of IT Operations Analytics,https://www.rocana.com/,"Boston, MA",USA,Omer Trajman,otrajman,twitter.com/otrajman,https://www.rocana.com/careers,
New,Rocketrip,twitter.com/rocketrip,51-200,Rocketrip helps enterprise companies reduce travel costs ,https://www.rocketrip.com/,"New York, NY",USA,Dan Ruch,,,,
Old,Run the World Digital,N/A,11-50,Progressive political and non-profit digital fundraising firm,https://www.runtheworlddigital.com/,"Madison, WI",USA,Heather Colburn,,N/A,,
